Campaign,Ad Group,Ad Type,Ad Status,Final URL,Headline 1,Headline 2,Headline 3,Headline 4,Headline 5,Headline 6,Headline 7,Headline 8,Headline 9,Headline 10,Headline 11,Headline 12,Headline 13,Headline 14,Headline 15,Description 1,Description 2,Description 3,Description 4
Kehastuudio - LPG & Kehakujundus,LPG Massaaž,Responsive search ad,Enabled,https://kehastuudio.ee,LPG Massaaž Tallinnas,Kehastuudio - 16+ Aastat,Tasuta Konsultatsioon,FDA Heakskiidetud Seadmed,Nähtav Tulemus 1. Korrast,LPG Endermoloogia,Broneeri Aeg Veebis,Kuni 60% Soodustust,Professionaalne Meeskond,Ilma Operatsioonita,Paindlik Järelmaks,Valuvaba Protseduur,Prantsuse Tehnoloogia,Tartu mnt 52 Tallinn,Personaalne Lähenemine,"Professionaalne LPG massaaž ja kehakujundus Tallinnas. 16+ aastat kogemust. Broneeri!","LPG Endermoloogia Prantsusmaalt. Valuvaba, taastumisaega pole vaja. Broneeri veebis!","FDA heakskiidetud tehnoloogiad. Nähtavad tulemused juba esimesest korrast!","Euroopa tipptasemel kehatehnoloogiad. Paketid kuni 60% soodsamalt. Järelmaks võimalik."
Kehastuudio - LPG & Kehakujundus,Kehakujundus,Responsive search ad,Enabled,https://kehastuudio.ee,Kehakujundus Tallinnas,Kehastuudio - 16+ Aastat,Tasuta Konsultatsioon,Ilma Operatsioonita,Nähtav Tulemus 1. Korrast,Kuni 60% Soodustust,Broneeri Aeg Veebis,FDA Heakskiidetud Seadmed,Professionaalne Meeskond,Paindlik Järelmaks,Personaalne Raviplaan,Rasva Vähendamine,Best Body Combo,Tartu mnt 52 Tallinn,4 Tehnoloogiat Korraga,"Professionaalne kehakujundus ja rasvapõletus Tallinnas. 16+ aastat kogemust. Broneeri!","Saavuta unistuste keha ilma operatsioonita. Nähtavad tulemused juba esimesest korrast!","Kombineeri 4 tehnoloogiat ühes seanssis. Best Body Combo pakett sinu eesmärkide jaoks.","MEGA40 pakett: 40 protseduuri soodushinnaga. Pakettidel aegumistähtaega ei ole!"
Kehastuudio - LPG & Kehakujundus,Cryolipolysis,Responsive search ad,Enabled,https://kehastuudio.ee,Cryolipolysis Tallinn,Rasva Külmutamine,Kehastuudio - 16+ Aastat,Tasuta Konsultatsioon,FDA Heakskiidetud Seadmed,Ilma Operatsioonita,Nähtav Tulemus 1. Korrast,Kuni 60% Soodustust,Broneeri Aeg Veebis,Paindlik Järelmaks,Professionaalne Meeskond,Valuvaba Protseduur,Tartu mnt 52 Tallinn,Personaalne Lähenemine,Taastumisaega Pole,"Cryolipolysis ehk rasva külmutamine Tallinnas. FDA heakskiidetud. Tasuta konsultatsioon!","Rasvapõletus külmutamisega - valuvaba ja efektiivne. Nähtavad tulemused 1. korrast!","Professionaalne kehakujundus ilma operatsioonita. 16+ aastat kogemust. Broneeri nüüd!","Euroopa tipptasemel tehnoloogiad. Paketid kuni 60% soodsamalt. Järelmaks võimalik."
Kehastuudio - Tselluliit & Nahk,Tselluliidiravi,Responsive search ad,Enabled,https://kehastuudio.ee,Tselluliidiravi Tallinnas,LPG Tselluliidimassaaž,Kehastuudio - 16+ Aastat,Tasuta Konsultatsioon,Nähtav Tulemus 1. Korrast,Kuni 60% Soodustust,Professionaalne Meeskond,FDA Heakskiidetud Seadmed,Broneeri Aeg Veebis,Paindlik Järelmaks,Apelsininahast Vabaks,Personaalne Raviplaan,Tartu mnt 52 Tallinn,Valuvaba Protseduur,Prantsuse Tehnoloogia,"Professionaalne tselluliidiravi Tallinnas. LPG massaaž ja kombineeritud teraapiad. Broneeri!","Tselluliit, rasvapõletus, naha pinguldamine. Personaalne raviplaan. Tartu mnt 52, Tallinn.","LPG Endermoloogia Prantsusmaalt. Valuvaba, taastumisaega pole vaja. Broneeri aeg veebis!","Saavuta sile nahk ilma operatsioonita. Nähtavad tulemused juba esimesest korrast!"
Kehastuudio - Tselluliit & Nahk,Naha Pinguldamine,Responsive search ad,Enabled,https://kehastuudio.ee,Naha Pinguldamine,RF Teraapia Tallinn,Kehastuudio - 16+ Aastat,Tasuta Konsultatsioon,Nähtav Tulemus 1. Korrast,Kollageeni Stimulatsioon,FDA Heakskiidetud Seadmed,Kuni 60% Soodustust,Broneeri Aeg Veebis,Professionaalne Meeskond,Paindlik Järelmaks,Naha Noorenemiseks,Tartu mnt 52 Tallinn,Personaalne Lähenemine,Ilma Operatsioonita,"RF teraapia ja naha pinguldamine Tallinnas. Kollageeni stimulatsioon. Tasuta konsultatsioon!","Nahanoorenemise protseduurid professionaalses stuudios. Nähtavad tulemused 1. korrast!","Professionaalne nahahooldus FDA heakskiidetud seadmetega. 16+ aastat kogemust. Broneeri!","Euroopa tipptasemel tehnoloogiad naha pinguldamiseks. Paketid kuni 60% soodsamalt."
Kehastuudio - Tselluliit & Nahk,Üldine,Responsive search ad,Enabled,https://kehastuudio.ee,Kehastuudio Tallinn,Iluprotseduurid Tallinnas,16+ Aastat Kogemust,Tasuta Konsultatsioon,FDA Heakskiidetud Seadmed,Kuni 60% Soodustust,Broneeri Aeg Veebis,Professionaalne Meeskond,Nähtav Tulemus 1. Korrast,Paindlik Järelmaks,Tartu mnt 52 Tallinn,Personaalne Lähenemine,Kehahoolitsus Profidelt,Ilma Operatsioonita,Euroopa Tehnoloogiad,"Kehastuudio - professionaalne kehakujundus ja iluprotseduurid Tallinnas. Broneeri aeg!","LPG massaaž, cryolipolysis, RF teraapia. Tasuta konsultatsioon. FDA heakskiidetud seadmed.","Saavuta unistuste keha ilma operatsioonita. Nähtavad tulemused juba esimesest korrast!","Euroopa tipptasemel kehatehnoloogiad. Paketid kuni 60% soodsamalt. Järelmaks võimalik."
